{
  "version": "1.0",
  "generatedAt": "2026-07-27",
  "count": 12,
  "resources": [
    {
      "id": "agile-estimating-and-planning",
      "title": "Agile Estimating and Planning",
      "category": "Books",
      "subcategory": "Planning and Estimation",
      "website": "https://www.pearson.com/en-us/subject-catalog/p/agile-estimating-and-planning/P200000003366",
      "tags": [
        "Estimation",
        "Planning",
        "Scrum"
      ],
      "price": "Paid",
      "featured": false,
      "audience": [],
      "difficulty": null,
      "githubUrl": null,
      "officialUrl": null,
      "pointaroRecommended": false,
      "status": "active",
      "lastReviewed": "2026-07-27",
      "description": "Mike Cohn presents practical estimation and release planning techniques for Agile teams.",
      "slug": "agile-estimating-and-planning",
      "file": "resources/books/agile-estimating-and-planning.md"
    },
    {
      "id": "azure-devops",
      "title": "Azure DevOps",
      "category": "Tools",
      "subcategory": "ALM Platform",
      "website": "https://azure.microsoft.com/products/devops",
      "tags": [
        "Scrum",
        "DevOps",
        "Planning"
      ],
      "price": "Paid",
      "featured": false,
      "audience": [],
      "difficulty": null,
      "githubUrl": null,
      "officialUrl": null,
      "pointaroRecommended": false,
      "status": "active",
      "lastReviewed": "2026-07-27",
      "description": "Azure DevOps is an integrated platform for planning, source control, CI/CD, and quality management.",
      "slug": "azure-devops",
      "file": "resources/tools/azure-devops.md"
    },
    {
      "id": "clean-agile",
      "title": "Clean Agile",
      "category": "Books",
      "subcategory": "Agile Foundations",
      "website": "https://www.pearson.com/en-us/subject-catalog/p/clean-agile-back-to-basics/P200000003471",
      "tags": [
        "Scrum",
        "Agile Mindset",
        "Software Craftsmanship"
      ],
      "price": "Paid",
      "featured": true,
      "audience": [],
      "difficulty": null,
      "githubUrl": null,
      "officialUrl": null,
      "pointaroRecommended": false,
      "status": "active",
      "lastReviewed": "2026-07-27",
      "description": "Clean Agile by Robert C. Martin revisits Agile values and principles from their original intent.",
      "slug": "clean-agile",
      "file": "resources/books/clean-agile.md"
    },
    {
      "id": "jira",
      "title": "Jira",
      "category": "Tools",
      "subcategory": "Project Management",
      "website": "https://www.atlassian.com/software/jira",
      "tags": [
        "Scrum",
        "Agile",
        "Issue Tracking"
      ],
      "price": "Paid",
      "featured": false,
      "audience": [],
      "difficulty": null,
      "githubUrl": null,
      "officialUrl": null,
      "pointaroRecommended": false,
      "status": "active",
      "lastReviewed": "2026-07-27",
      "description": "Jira is a widely used issue tracking and project management platform for Agile software teams.",
      "slug": "jira",
      "file": "resources/tools/jira.md"
    },
    {
      "id": "linear",
      "title": "Linear",
      "category": "Tools",
      "subcategory": "Issue Tracking",
      "website": "https://linear.app",
      "tags": [
        "Scrum",
        "Product Management",
        "Issue Tracking"
      ],
      "price": "Paid",
      "featured": true,
      "audience": [],
      "difficulty": null,
      "githubUrl": null,
      "officialUrl": null,
      "pointaroRecommended": false,
      "status": "active",
      "lastReviewed": "2026-07-27",
      "description": "Linear is a fast and minimal issue tracking tool focused on modern product and engineering workflows.",
      "slug": "linear",
      "file": "resources/tools/linear.md"
    },
    {
      "id": "martin-fowler-agile-articles",
      "title": "Martin Fowler Agile Articles",
      "category": "Websites",
      "subcategory": "Technical and Agile Practices",
      "website": "https://martinfowler.com/agile.html",
      "tags": [
        "Agile",
        "Engineering Practices",
        "Continuous Delivery"
      ],
      "price": "Free",
      "featured": false,
      "audience": [],
      "difficulty": null,
      "githubUrl": null,
      "officialUrl": null,
      "pointaroRecommended": false,
      "status": "active",
      "lastReviewed": "2026-07-27",
      "description": "A curated set of essays and references on Agile methods, software architecture, and delivery practices.",
      "slug": "martin-fowler-agile-articles",
      "file": "resources/websites/martin-fowler-agile-articles.md"
    },
    {
      "id": "miro",
      "title": "Miro",
      "category": "Tools",
      "subcategory": "Collaboration Whiteboard",
      "website": "https://miro.com",
      "tags": [
        "Retrospectives",
        "Facilitation",
        "Remote Teams"
      ],
      "price": "Paid",
      "featured": false,
      "audience": [],
      "difficulty": null,
      "githubUrl": null,
      "officialUrl": null,
      "pointaroRecommended": false,
      "status": "active",
      "lastReviewed": "2026-07-27",
      "description": "Miro is an online whiteboard platform used for facilitation, planning, workshops, and collaborative Agile ceremonies.",
      "slug": "miro",
      "file": "resources/tools/miro.md"
    },
    {
      "id": "scrum-guide",
      "title": "Scrum Guide",
      "category": "Websites",
      "subcategory": "Official Framework Guide",
      "website": "https://scrumguides.org",
      "tags": [
        "Scrum",
        "Framework",
        "Roles"
      ],
      "price": "Free",
      "featured": true,
      "audience": [],
      "difficulty": null,
      "githubUrl": null,
      "officialUrl": null,
      "pointaroRecommended": false,
      "status": "active",
      "lastReviewed": "2026-07-27",
      "description": "The Scrum Guide is the official and canonical definition of Scrum by its creators.",
      "slug": "scrum-guide",
      "file": "resources/websites/scrum-guide.md"
    },
    {
      "id": "scrum-art-of-doing-twice-the-work-in-half-the-time",
      "title": "Scrum: The Art of Doing Twice the Work in Half the Time",
      "category": "Books",
      "subcategory": "Scrum",
      "website": "https://www.penguinrandomhouse.com/books/232913/scrum-by-jeff-sutherland/",
      "tags": [
        "Scrum",
        "Team Performance",
        "Leadership"
      ],
      "price": "Paid",
      "featured": false,
      "audience": [],
      "difficulty": null,
      "githubUrl": null,
      "officialUrl": null,
      "pointaroRecommended": false,
      "status": "active",
      "lastReviewed": "2026-07-27",
      "description": "Jeff Sutherland introduces Scrum concepts and stories showing how iterative delivery can improve outcomes.",
      "slug": "scrum-art-of-doing-twice-the-work-in-half-the-time",
      "file": "resources/books/scrum-art-of-doing-twice-the-work-in-half-the-time.md"
    },
    {
      "id": "sprint-retrospective-template",
      "title": "Sprint Retrospective Template",
      "category": "Templates",
      "subcategory": "Retrospective Facilitation",
      "website": "https://miro.com/templates/sprint-retrospective/",
      "tags": [
        "Retrospectives",
        "Scrum",
        "Team Improvement"
      ],
      "price": "Free",
      "featured": false,
      "audience": [],
      "difficulty": null,
      "githubUrl": null,
      "officialUrl": null,
      "pointaroRecommended": false,
      "status": "active",
      "lastReviewed": "2026-07-27",
      "description": "A reusable retrospective format for inspecting team outcomes and defining measurable improvements.",
      "slug": "sprint-retrospective-template",
      "file": "resources/templates/sprint-retrospective-template.md"
    },
    {
      "id": "trello",
      "title": "Trello",
      "category": "Tools",
      "subcategory": "Kanban Board",
      "website": "https://trello.com",
      "tags": [
        "Kanban",
        "Team Collaboration",
        "Task Management"
      ],
      "price": "Free",
      "featured": false,
      "audience": [],
      "difficulty": null,
      "githubUrl": null,
      "officialUrl": null,
      "pointaroRecommended": false,
      "status": "active",
      "lastReviewed": "2026-07-27",
      "description": "Trello is a simple, card-based project management tool that helps teams visualize and track work.",
      "slug": "trello",
      "file": "resources/tools/trello.md"
    },
    {
      "id": "user-story-template",
      "title": "User Story Template",
      "category": "Templates",
      "subcategory": "Backlog Refinement",
      "website": "https://www.atlassian.com/agile/project-management/user-stories",
      "tags": [
        "User Stories",
        "Backlog",
        "Product Management"
      ],
      "price": "Free",
      "featured": false,
      "audience": [],
      "difficulty": null,
      "githubUrl": null,
      "officialUrl": null,
      "pointaroRecommended": false,
      "status": "active",
      "lastReviewed": "2026-07-27",
      "description": "A standard user story format that captures role, need, and value to improve backlog clarity.",
      "slug": "user-story-template",
      "file": "resources/templates/user-story-template.md"
    }
  ]
}
